{
  "$schema": "https://json-schema.org/draft/2020-12/schema",
  "title": "library",
  "type": "object",
  "properties": {
    "schema_version": {
      "const": 1
    },
    "remote": {
      "type": "string"
    },
    "shared_branch": {
      "type": "string"
    },
    "platform": {
      "enum": [
        "github",
        "local",
        "unconfigured"
      ]
    },
    "deployment_mode": {
      "enum": [
        "protected",
        "owner_trial",
        "public_write"
      ]
    },
    "workspace": {
      "type": "string",
      "minLength": 1
    },
    "publish_mode": {
      "enum": [
        "request",
        "direct"
      ]
    },
    "auto_merge": {
      "type": "boolean"
    },
    "target_profiles": {
      "type": "object",
      "additionalProperties": {
        "type": "object",
        "properties": {
          "path": {
            "type": "string",
            "minLength": 1
          },
          "tool": {
            "type": "string",
            "minLength": 1
          }
        },
        "required": [
          "path"
        ],
        "additionalProperties": false
      }
    },
    "review_mode": {
      "enum": [
        "manual",
        "automatic"
      ]
    }
  },
  "required": [
    "schema_version",
    "remote",
    "shared_branch",
    "platform",
    "workspace",
    "publish_mode",
    "auto_merge",
    "target_profiles"
  ],
  "additionalProperties": false,
  "allOf": [
    {
      "if": {
        "properties": {
          "deployment_mode": {
            "const": "public_write"
          }
        },
        "required": [
          "deployment_mode"
        ]
      },
      "then": {
        "properties": {
          "platform": {
            "const": "github"
          },
          "publish_mode": {
            "const": "direct"
          },
          "auto_merge": {
            "const": false
          }
        }
      }
    },
    {
      "if": {
        "properties": {
          "publish_mode": {
            "const": "direct"
          }
        },
        "required": [
          "publish_mode"
        ]
      },
      "then": {
        "properties": {
          "deployment_mode": {
            "const": "public_write"
          },
          "platform": {
            "const": "github"
          },
          "auto_merge": {
            "const": false
          }
        },
        "required": [
          "deployment_mode"
        ]
      }
    },
    {
      "if": {
        "properties": {
          "deployment_mode": {
            "const": "owner_trial"
          }
        },
        "required": [
          "deployment_mode"
        ]
      },
      "then": {
        "properties": {
          "platform": {
            "const": "github"
          }
        }
      }
    },
    {
      "if": {
        "properties": {
          "platform": {
            "const": "local"
          }
        },
        "required": [
          "platform"
        ]
      },
      "then": {
        "properties": {
          "remote": {
            "type": "string",
            "pattern": "^(?:file:///[^?#\\x00-\\x1f]+|(?!-)(?!\\\\)[^:@\\x00-\\x1f]+)(?![\\s\\S])",
            "minLength": 1
          },
          "shared_branch": {
            "type": "string",
            "minLength": 1
          }
        }
      }
    },
    {
      "if": {
        "properties": {
          "platform": {
            "const": "unconfigured"
          }
        },
        "required": [
          "platform"
        ]
      },
      "then": {
        "properties": {
          "remote": {
            "const": ""
          },
          "shared_branch": {
            "const": ""
          }
        }
      }
    },
    {
      "if": {
        "properties": {
          "auto_merge": {
            "const": true
          }
        },
        "required": [
          "auto_merge"
        ]
      },
      "then": {
        "properties": {
          "review_mode": {
            "const": "automatic"
          },
          "deployment_mode": {
            "const": "owner_trial"
          },
          "platform": {
            "const": "github"
          }
        },
        "required": [
          "review_mode",
          "deployment_mode"
        ]
      }
    }
  ]
}
